ï»¿id,game,start_date,end_date,price,seller,year,real_value,id
1,Subnautica,2018-12-12,27/12/2018,29.99,Unknown Worlds Entertainment,2018,39.5868,0
2,Super Meat Boy,2018-12-28,10/01/2019,14.99,Unknown Publisher,2018,19.7868,0
3,What Remains of Edith Finch,2019-01-11,24/01/2019,19.99,Annapurna Interactive,2019,25.7871,0
4,The Jackbox Party Pack,2019-01-24,07/02/2019,24.99,"Jackbox Games, Inc.",2019,32.2371,0
5,Axiom Verge,2019-02-07,21/02/2019,19.99,Thomas Happ Games Llc,2019,25.7871,0
6,Thimbleweed Park,2019-02-21,07/03/2019,19.99,Terrible Toybox,2019,25.7871,0
7,Slime Rancher,2019-03-07,21/03/2019,19.99,Monomi Park,2019,25.7871,0
8,Oxenfree,2019-03-21,04/04/2019,9.99,Night School Studio,2019,12.8871,0
9,The Witness,2019-04-04,18/04/2019,39.99,"Thekla, Inc.",2019,51.58710000000001,0
10,Transistor,2019-04-18,02/05/2019,19.99,Supergiant Games,2019,25.7871,0
11,World of Goo,2019-05-02,16/05/2019,14.99,2D Boy,2019,19.3371,0
12,Stories Untold,2019-05-16,30/05/2019,9.99,Devolver Digital,2019,12.8871,0
13,RiME,2019-05-23,30/05/2019,29.99,Grey Box,2019,38.6871,0
14,City of Brass,2019-05-30,06/06/2019,19.99,Uppercut Games Pty Ltd,2019,25.7871,0
15,Kingdom: New Lands,2019-06-06,13/06/2019,14.99,Raw Fury,2019,19.3371,0
16,Enter the Gungeon,2019-06-13,20/06/2019,14.99,Devolver Digital,2019,19.3371,0
17,Rebel Galaxy,2019-06-20,27/06/2019,19.99,Double Damage Games,2019,25.7871,0
18,Last Day of June,2019-06-27,04/07/2019,19.99,505 Games,2019,25.7871,0
19,Overcooked!,2019-07-04,11/07/2019,16.99,Team17 Digital Ltd,2019,21.917099999999998,0
20,Torchlight,2019-07-11,18/07/2019,14.99,Xd,2019,19.3371,0
21,Limbo,2019-07-18,25/07/2019,12.49,Playdead,2019,16.1121,0
22,Moonlighter,2019-07-25,01/08/2019,19.99,11 Bit Studios,2019,25.7871,0
23,This War of Mine,2019-07-25,01/08/2019,19.99,11 Bit Studios,2019,25.7871,0
24,Alan Wake,2019-08-02,09/08/2019,14.99,Remedy Entertainment,2019,19.3371,0
25,For Honor,2019-08-02,09/08/2019,29.99,Ubisoft,2019,38.6871,0
26,GNOG,2019-08-08,15/08/2019,9.99,Ko_Op,2019,12.8871,0
27,Hyper Light Drifter,2019-08-15,22/08/2019,19.99,Heart Machine,2019,25.7871,0
28,Mutant Year Zero: Road to Eden,2019-08-15,22/08/2019,34.99,Funcom,2019,45.137100000000004,0
29,Fez,2019-08-22,29/08/2019,9.99,Trapdoor,2019,12.8871,0
30,Celeste,2019-08-29,05/09/2019,19.99,Maddy Makes Games Inc.,2019,25.7871,0
31,Inside,2019-08-29,05/09/2019,24.99,Playdead,2019,32.2371,0
32,ABZU,2019-09-05,12/09/2019,19.99,505 Games,2019,25.7871,0
33,The End is Nigh,2019-09-05,12/09/2019,14.99,Edmund Mcmillen,2019,19.3371,0
34,Conarium,2019-09-12,19/09/2019,19.99,Iceberg Interactive,2019,25.7871,0
35,Batman: Arkham Asylum,2019-09-19,26/09/2019,19.99,Unknown Publisher,2019,25.7871,0
36,Batman: Arkham City,2019-09-19,26/09/2019,19.99,Warner Bros. Interactive Entertainment,2019,25.7871,0
37,Batman: Arkham Collection,2019-09-19,26/09/2019,59.99,Unknown Publisher,2019,77.3871,0
38,BATMAN: ARKHAM KNIGHT,2019-09-19,26/09/2019,19.99,Wb Games,2019,25.7871,0
39,LEGO Batman Trilogy,2019-09-19,26/09/2019,49.99,Unknown Publisher,2019,64.4871,0
40,LEGO Batman: The Video Game,2019-09-19,26/09/2019,19.99,Unknown Publisher,2019,25.7871,0
41,LEGO Batman 2: DC Super Heroes,2019-09-19,26/09/2019,19.99,Warner Bros. Interactive Entertainment,2019,25.7871,0
42,LEGO Batman 3: Beyond Gotham,2019-09-19,26/09/2019,19.99,Wb Games,2019,25.7871,0
43,Everything,2019-09-26,03/10/2019,14.99,David Oreilly,2019,19.3371,0
44,Metro 2033 Redux,2019-09-26,03/10/2019,19.99,Deep Silver,2019,25.7871,0
45,Minit,2019-10-03,10/10/2019,9.99,Devolver Digital,2019,12.8871,0
46,Surviving Mars,2019-10-10,17/10/2019,29.99,Paradox Interactive,2019,38.6871,0
47,Alan Wake's: American Nightmare,2019-10-17,28/10/2019,8.99,Remedy Entertainment,2019,11.597100000000001,0
48,Layers of Fear,2019-10-24,31/10/2019,29.99,Bloober Team Sa,2019,38.6871,0
49,Observer,2019-10-24,31/10/2019,29.99,Bloober Team,2019,38.6871,0
50,Costume Quest,2019-10-31,07/11/2019,9.99,Double Fine Productions,2019,12.8871,0
51,Q.U.B.E. 2,2019-10-31,07/11/2019,24.99,Trapped Nerve Games,2019,32.2371,0
52,SOMA,2019-10-31,07/11/2019,29.99,Frictional Games,2019,38.6871,0
53,Nuclear Throne,2019-11-07,14/11/2019,11.99,Vlambeer,2019,15.4671,0
54,Ruiner,2019-11-07,14/11/2019,19.99,Devolver Digital,2019,25.7871,0
55,The Messenger,2019-11-14,21/11/2019,19.99,Devolver Digital,2019,25.7871,0
56,Bad North: Jotunn Edition,2019-11-21,29/11/2019,14.99,Raw Fury,2019,19.3371,0
57,Rayman Legends,2019-11-29,06/12/2019,29.99,Ubisoft,2019,38.6871,0
58,Jotun: Valhalla Edition,2019-12-05,12/12/2019,14.99,Thunder Lotus,2019,19.3371,0
59,The Escapists,2019-12-12,19/12/2019,17.99,Team17,2019,23.207099999999997,0
60,The Wolf Among Us,2019-12-12,19/12/2019,14.99,Telltale,2019,19.3371,0
61,Into the Breach,2019-12-19,20/12/2019,14.99,Subset Games,2019,19.3371,0
62,TowerFall Ascension,2019-12-20,21/12/2019,14.99,Unknown Publisher,2019,19.3371,0
63,Superhot,2019-12-21,22/12/2019,24.99,Superhot Team,2019,32.2371,0
64,Little Inferno,2019-12-22,23/12/2019,14.99,Tomorrow Corporation,2019,19.3371,0
65,Ape Out,2019-12-23,24/12/2019,14.99,Devolver Digital,2019,19.3371,0
66,Celeste (repeat),2019-12-24,25/12/2019,0.0,Unknown Publisher,2019,0.0,0
67,Totally Accurate Battle Simulator,2019-12-25,26/12/2019,19.99,Landfall,2019,25.7871,0
68,FTL: Faster Than Light,2019-12-26,27/12/2019,9.99,Subset Games,2019,12.8871,0
69,Hyper Light Drifter,2019-12-27,28/12/2019,19.99,Heart Machine,2019,25.7871,0
70,Shadow Tactics: Blades of the Shogun,2019-12-28,29/12/2019,39.99,Daedalic Entertainment,2019,51.58710000000001,0
71,The Talos Principle,2019-12-29,30/12/2019,29.99,Devolver Digital,2019,38.6871,0
72,Hello Neighbor,2019-12-30,31/12/2019,29.99,Tinybuild,2019,38.6871,0
73,Yooka-Laylee and the Impossible Lair,2019-12-31,01/01/2020,29.99,Team17 Digital Ltd,2019,38.6871,0
74,Darksiders,2020-01-01,09/01/2020,39.99,Thq Nordic,2020,50.7873,0
75,Darksiders II,2020-01-01,09/01/2020,39.99,Thq Nordic,2020,50.7873,0
76,Steep,2020-01-01,09/01/2020,29.99,Ubisoft,2020,38.0873,0
77,Sundered: Eldritch Edition,2020-01-09,16/01/2020,19.99,Thunder Lotus,2020,25.3873,0
78,Horace,2020-01-16,23/01/2020,14.99,505 Games,2020,19.037300000000002,0
79,The Bridge,2020-01-23,30/01/2020,9.99,The Quantum Astrophysicists Guild,2020,12.6873,0
80,Farming Simulator 19,2020-01-30,06/02/2020,17.99,Giants Software,2020,22.847299999999997,0
81,Carcassonne,2020-02-06,13/02/2020,9.99,Twin Sails Interactive,2020,12.6873,0
82,Ticket to Ride,2020-02-06,13/02/2020,14.99,Marmalade Game Studio Ltd,2020,19.037300000000002,0
83,Aztez,2020-02-13,20/02/2020,19.99,Team Colorblind,2020,25.3873,0
84,Kingdom Come: Deliverance,2020-02-13,20/02/2020,29.99,Warhorse Studios,2020,38.0873,0
85,Assassin's Creed Syndicate,2020-02-20,27/02/2020,29.99,Ubisoft,2020,38.0873,0
86,Faeria,2020-02-20,27/02/2020,19.99,Versus Evil,2020,25.3873,0
87,InnerSpace,2020-02-27,05/03/2020,19.99,Aspyr,2020,25.3873,0
88,GoNNER,2020-03-05,12/03/2020,9.99,Raw Fury,2020,12.6873,0
89,Offworld Trading Company,2020-03-05,12/03/2020,29.99,Stardock Entertainment,2020,38.0873,0
90,A Short Hike,2020-03-12,19/03/2020,7.99,Adamgryu,2020,10.1473,0
91,Anodyne 2: Return to Dust,2020-03-12,19/03/2020,19.99,Analgesic Productions,2020,25.3873,0
92,Mutazione,2020-03-12,19/03/2020,19.99,Akupara Games,2020,25.3873,0
93,The Stanley Parable,2020-03-19,26/03/2020,14.99,Galactic Cafe,2020,19.037300000000002,0
94,Watch Dogs,2020-03-19,26/03/2020,19.99,Ubisoft,2020,25.3873,0
95,Figment,2020-03-26,02/04/2020,19.99,Bedtime Digital Games,2020,25.3873,0
96,Tormentor x Punisher,2020-03-26,02/04/2020,7.99,Unknown Publisher,2020,10.1473,0
97,World War Z,2020-03-26,02/04/2020,29.99,Saber Interactive Inc,2020,38.0873,0
98,Drawful 2,2020-04-02,09/04/2020,9.99,"Jackbox Games, Inc.",2020,12.6873,0
99,Gone Home,2020-04-02,09/04/2020,14.99,Fullbright,2020,19.037300000000002,0
100,Hob,2020-04-02,09/04/2020,19.99,Arc Games,2020,25.3873,0
101,Totally Reliable Delivery Service,2020-04-02,09/04/2020,14.99,Infogrames,2020,19.037300000000002,0
102,Close to the Sun,2020-04-09,16/04/2020,19.99,Wired Productions,2020,25.3873,0
103,Sherlock Holmes: Crimes and Punishments,2020-04-09,16/04/2020,29.99,Frogwares,2020,38.0873,0
104,Just Cause 4,2020-04-16,23/04/2020,59.99,Square Enix,2020,76.18730000000001,0
105,Wheels of Aurelia,2020-04-16,23/04/2020,14.99,Santa Ragione,2020,19.037300000000002,0
106,For the King,2020-04-23,30/04/2020,19.99,Curve Games,2020,25.3873,0
107,Amnesia: The Dark Descent,2020-04-30,07/05/2020,19.99,Frictional Games,2020,25.3873,0
108,Crashlands,2020-04-30,07/05/2020,14.99,Butterscotch Shenanigans,2020,19.037300000000002,0
109,Death Coming,2020-05-07,14/05/2020,6.99,Next Studios,2020,8.8773,0
110,Grand Theft Auto V,2020-05-14,21/05/2020,29.99,Rockstar Games,2020,38.0873,0
111,Sid Meier's Civilization VI,2020-05-21,28/05/2020,59.99,2K,2020,76.18730000000001,0
112,Borderlands 2,2020-05-28,04/06/2020,19.99,2K,2020,25.3873,0
113,Borderlands: The Handsome Collection,2020-05-28,04/06/2020,59.99,Unknown Publisher,2020,76.18730000000001,0
114,Borderlands: The Pre-Sequel,2020-05-28,04/06/2020,39.99,2K,2020,50.7873,0
115,Overcooked!,2020-06-04,11/06/2020,16.99,Team17 Digital Ltd,2020,21.577299999999997,0
116,Ark: Survival Evolved,2020-06-11,18/06/2020,14.99,Studio Wildcard,2020,19.037300000000002,0
117,Samurai Shodown NeoGeo Collection,2020-06-11,18/06/2020,39.99,Snk Corporation,2020,50.7873,0
118,Pathway,2020-06-18,25/06/2020,15.99,Chucklefish,2020,20.3073,0
119,AER: Memories of Old,2020-06-25,02/07/2020,14.99,Daedalic Entertainment,2020,19.037300000000002,0
120,Stranger Things 3: The Game,2020-06-25,02/07/2020,0.0,Unknown Publisher,2020,0.0,0
121,Hue,2020-07-02,09/07/2020,14.99,Curve Games,2020,19.037300000000002,0
122,Killing Floor 2,2020-07-09,16/07/2020,29.99,Tripwire Interactive,2020,38.0873,0
123,Lifeless Planet: Premier Edition,2020-07-09,16/07/2020,9.99,Serenity Forge,2020,12.6873,0
124,The Escapists 2,2020-07-09,16/07/2020,19.99,Team17,2020,25.3873,0
125,Torchlight II,2020-07-16,23/07/2020,19.99,Xd,2020,25.3873,0
126,Next Up Hero,2020-07-23,30/07/2020,19.99,Digital Continue,2020,25.3873,0
127,Tacoma,2020-07-23,30/07/2020,19.99,Fullbright,2020,25.3873,0
128,20XX,2020-07-30,06/08/2020,14.99,Batterystaple Games,2020,19.037300000000002,0
129,Barony,2020-07-30,06/08/2020,19.99,Turning Wheel Llc,2020,25.3873,0
130,Superbrothers: Sword & Sworcery EP,2020-07-30,06/08/2020,7.99,Capybara Games,2020,10.1473,0
131,3 out of 10: Season One,2020-08-06,13/08/2020,0.0,Unknown Publisher,2020,0.0,0
132,Wilmot's Warehouse,2020-08-06,13/08/2020,14.99,Finji,2020,19.037300000000002,0
133,Remnant: From the Ashes,2020-08-13,20/08/2020,39.99,Arc Games,2020,50.7873,0
134,The Alto Collection,2020-08-13,20/08/2020,9.99,Snowman,2020,12.6873,0
135,Enter the Gungeon,2020-08-20,27/08/2020,14.99,Devolver Digital,2020,19.037300000000002,0
136,God's Trigger,2020-08-20,27/08/2020,14.99,Techland Publishing,2020,19.037300000000002,0
137,Hitman (2016),2020-08-27,03/09/2020,0.0,Unknown Publisher,2020,0.0,0
138,Shadowrun Collection,2020-08-27,03/09/2020,0.0,Unknown Publisher,2020,0.0,0
139,Into the Breach,2020-09-03,10/09/2020,14.99,Subset Games,2020,19.037300000000002,0
140,Railway Empire,2020-09-10,17/09/2020,29.99,Kalypso Media,2020,38.0873,0
141,Where the Water Tastes Like Wine,2020-09-10,17/09/2020,19.99,Good Shepherd Entertainment,2020,25.3873,0
142,A Total War Saga: Troy,2020-09-13,13/09/2020,49.99,Sega,2020,63.487300000000005,0
143,Football Manager 2020,2020-09-17,24/09/2020,0.0,Sega,2020,0.0,0
144,Stick It To The Man!,2020-09-17,24/09/2020,7.99,Ripstone,2020,10.1473,0
145,Watch Dogs 2,2020-09-17,24/09/2020,49.99,Ubisoft,2020,63.487300000000005,0
146,RollerCoaster Tycoon 3: Complete Edition,2020-09-24,01/10/2020,19.99,Unknown Publisher,2020,25.3873,0
147,Pikuniku,2020-10-01,08/10/2020,12.99,Devolver Digital,2020,16.4973,0
148,ABZU,2020-10-08,15/10/2020,19.99,505 Games,2020,25.3873,0
149,Rising Storm 2: Vietnam,2020-10-08,15/10/2020,24.99,Tripwire Interactive,2020,31.737299999999998,0
150,Amnesia: A Machine for Pigs,2020-10-15,22/10/2020,19.99,Frictional Games,2020,25.3873,0
151,Kingdom New Lands,2020-10-15,22/10/2020,14.99,Raw Fury,2020,19.037300000000002,0
152,Costume Quest 2,2020-10-22,29/10/2020,14.99,Midnight City,2020,19.037300000000002,0
153,Layers of Fear 2,2020-10-22,29/10/2020,19.99,Bloober Team Sa,2020,25.3873,0
154,Blair Witch,2020-10-29,05/11/2020,29.99,Bloober Team Na,2020,38.0873,0
155,Ghostbusters: The Video Game Remastered,2020-10-29,05/11/2020,24.99,"Mad Dog Games, Llc",2020,31.737299999999998,0
156,Dungeons 3,2020-11-05,12/11/2020,29.99,Kalypso Media,2020,38.0873,0
157,The Textorcist: The Story of Ray Bibbia,2020-11-12,19/11/2020,14.99,Headup,2020,19.037300000000002,0
158,Elite Dangerous,2020-11-19,26/11/2020,19.99,Frontier Developments,2020,25.3873,0
159,The World Next Door,2020-11-19,26/11/2020,4.99,Viz Media,2020,6.3373,0
160,MudRunner,2020-11-26,03/12/2020,19.99,Focus Entertainment,2020,25.3873,0
161,Cave Story+,2020-12-03,10/12/2020,14.99,"Nicalis, Inc.",2020,19.037300000000002,0
162,Pillars of Eternity: Definitive Edition,2020-12-10,17/12/2020,39.99,Unknown Publisher,2020,50.7873,0
163,Tyranny: Gold Edition,2020-12-10,17/12/2020,49.99,Unknown Publisher,2020,63.487300000000005,0
164,Cities: Skylines,2020-12-17,18/12/2020,29.99,Paradox Interactive,2020,38.0873,0
165,Oddworld: New 'n' Tasty,2020-12-18,19/12/2020,19.99,"Oddworld Inhabitants, Inc.",2020,25.3873,0
166,The Long Dark,2020-12-19,20/12/2020,19.99,Hinterland Studio Inc.,2020,25.3873,0
167,Defense Grid: The Awakening,2020-12-20,21/12/2020,9.99,Hidden Path Entertainment,2020,12.6873,0
168,Alien: Isolation,2020-12-21,22/12/2020,39.99,Sega,2020,50.7873,0
169,Metro 2033 Redux,2020-12-22,23/12/2020,19.99,Deep Silver,2020,25.3873,0
170,Tropico 5,2020-12-23,24/12/2020,19.99,Kalypso Media Digital,2020,25.3873,0
171,Inside,2020-12-24,25/12/2020,24.99,Playdead,2020,31.737299999999998,0
172,Darkest Dungeon,2020-12-25,26/12/2020,24.99,Red Hook Studios,2020,31.737299999999998,0
173,My Time at Portia,2020-12-26,27/12/2020,29.99,Focus Entertainment,2020,38.0873,0
174,Night in the Woods,2020-12-27,28/12/2020,19.99,Finji,2020,25.3873,0
175,Stranded Deep,2020-12-28,29/12/2020,19.99,Beam Team Publishing,2020,25.3873,0
176,Solitairica,2020-12-29,30/12/2020,9.99,Righteous Hammer Games,2020,12.6873,0
177,Torchlight II,2020-12-30,31/12/2020,19.99,Xd,2020,25.3873,0
178,Jurassic World Evolution,2020-12-31,07/01/2021,44.99,Frontier Developments,2020,57.1373,0
179,Crying Suns,2021-01-07,14/01/2021,24.99,Humble Games,2021,30.487799999999996,0
180,STAR WARS Battlefront II,2021-01-14,21/01/2021,39.99,Electronic Arts,2021,48.787800000000004,0
181,Galactic Civilizations III,2021-01-21,28/01/2021,29.99,Stardock Entertainment,2021,36.587799999999994,0
182,Dandara,2021-01-28,04/02/2021,14.99,Raw Fury,2021,18.2878,0
183,For The King,2021-02-04,11/02/2021,19.99,Curve Games,2021,24.3878,0
184,Metro: Last Light Redux,2021-02-04,11/02/2021,19.99,Deep Silver,2021,24.3878,0
185,Halcyon 6: Starbase Commander,2021-02-11,18/02/2021,14.99,"Massive Damage, Inc.",2021,18.2878,0
186,Absolute Drift,2021-02-18,25/02/2021,11.99,Funselektor Labs Inc.,2021,14.6278,0
187,Rage 2,2021-02-18,25/02/2021,39.99,Bethesda Softworks,2021,48.787800000000004,0
188,Sunless Sea,2021-02-25,04/03/2021,18.99,Failbetter Games,2021,23.167799999999996,0
189,Wargame: Red Dragon,2021-03-04,11/03/2021,29.99,Eugen Systems,2021,36.587799999999994,0
190,Surviving Mars,2021-03-11,18/03/2021,29.99,Paradox Interactive,2021,36.587799999999994,0
191,The Fall,2021-03-18,25/03/2021,9.99,Over The Moon,2021,12.1878,0
192,Creature in the Well,2021-03-25,01/04/2021,14.99,Flight School Studio,2021,18.2878,0
193,Tales of the Neon Sea,2021-04-01,08/04/2021,14.99,Thermite Games,2021,18.2878,0
194,3 out of 10: Season Two,2021-04-08,15/04/2021,0.0,Unknown Publisher,2021,0.0,0
195,Deponia,2021-04-15,22/04/2021,9.99,Daedalic Entertainment,2021,12.1878,0
196,Ken Follett's The Pillars of the Earth,2021-04-15,22/04/2021,19.99,Daedalic Entertainment,2021,24.3878,0
197,The First Tree,2021-04-15,22/04/2021,9.99,David Wehle,2021,12.1878,0
198,Alien: Isolation,2021-04-22,29/04/2021,39.99,Sega,2021,48.787800000000004,0
199,Hand of Fate 2,2021-04-22,29/04/2021,29.99,Defiant Development,2021,36.587799999999994,0
200,Idle Champions of the Forgotten Realms,2021-04-29,06/05/2021,0.0,Codename Entertainment Inc.,2021,0.0,0
201,Pine,2021-05-06,13/05/2021,24.99,Maximum Entertainment,2021,30.487799999999996,0
202,The Lion's Song,2021-05-13,20/05/2021,7.99,Mi'Pu'Mi Games Gmbh,2021,9.7478,0
203,NBA 2K21,2021-05-20,27/05/2021,0.0,Unknown Publisher,2021,0.0,0
204,Among Us,2021-05-27,03/06/2021,4.99,Innersloth,2021,6.0878000000000005,0
205,Frostpunk,2021-06-03,10/06/2021,29.99,11 Bit Studios,2021,36.587799999999994,0
206,Control,2021-06-10,17/06/2021,4.99,Valve,2021,6.0878000000000005,0
207,Hell is Other Demons,2021-06-17,24/06/2021,9.99,Cuddle Monster Games,2021,12.1878,0
208,Overcooked! 2,2021-06-17,24/06/2021,24.99,Team17,2021,30.487799999999996,0
209,Horizon Chase Turbo,2021-06-24,01/07/2021,19.99,Aquiris,2021,24.3878,0
210,Sonic Mania,2021-06-24,01/07/2021,19.99,Sega,2021,24.3878,0
211,The Spectrum Retreat,2021-07-01,08/07/2021,12.99,Ripstone,2021,15.8478,0
212,Bridge Constructor: The Walking Dead,2021-07-08,15/07/2021,9.99,Headup,2021,12.1878,0
213,Ironcast,2021-07-08,15/07/2021,14.99,Ripstone,2021,18.2878,0
214,Obduction,2021-07-15,22/07/2021,29.99,Cyan Inc.,2021,36.587799999999994,0
215,Offworld Trading Company,2021-07-15,22/07/2021,29.99,Stardock Entertainment,2021,36.587799999999994,0
216,Defense Grid: The Awakening (repeat),2021-07-22,29/07/2021,0.0,Unknown Publisher,2021,0.0,0
217,Verdun,2021-07-22,29/07/2021,19.99,Blackmill Games,2021,24.3878,0
218,Mothergunship,2021-07-29,05/08/2021,24.99,Terrible Posture Games,2021,30.487799999999996,0
219,Train Sim World 2,2021-07-29,05/08/2021,19.99,Dovetail Games - Tsw,2021,24.3878,0
220,A Plague Tale: Innocence,2021-08-05,12/08/2021,39.99,Focus Entertainment,2021,48.787800000000004,0
221,Minit,2021-08-05,12/08/2021,9.99,Devolver Digital,2021,12.1878,0
222,Rebel Galaxy,2021-08-12,19/08/2021,19.99,Double Damage Games,2021,24.3878,0
223,Void Bastards,2021-08-19,26/08/2021,29.99,Blue Manchu,2021,36.587799999999994,0
224,Yooka-Laylee,2021-08-19,26/08/2021,19.99,Playtonic Friends,2021,24.3878,0
225,Automachef,2021-08-26,02/09/2021,14.99,Team17 Digital Ltd,2021,18.2878,0
226,Saints Row: The Third Remastered,2021-08-26,02/09/2021,29.99,Deep Silver,2021,36.587799999999994,0
227,Yoku's Island Express,2021-09-02,09/09/2021,19.99,Team17 Digital Ltd,2021,24.3878,0
228,Nioh: The Complete Edition,2021-09-09,16/09/2021,49.99,"Koei Tecmo Games Co., Ltd.",2021,60.9878,0
229,Sheltered,2021-09-09,16/09/2021,14.99,Team17 Digital Ltd,2021,18.2878,0
230,Speed Brawl,2021-09-16,23/09/2021,19.99,Double Stallion,2021,24.3878,0
231,Tharsis,2021-09-16,23/09/2021,14.99,Choice Provisions,2021,18.2878,0
232,The Escapists,2021-09-23,30/09/2021,17.99,Team17,2021,21.947799999999997,0
233,Europa Universalis IV,2021-09-30,07/10/2021,49.99,Paradox Interactive,2021,60.9878,0
234,PC Building Simulator,2021-10-07,14/10/2021,19.99,The Irregular Corporation,2021,24.3878,0
235,Stubbs the Zombie in Rebel Without a Pulse,2021-10-14,21/10/2021,19.99,Aspyr,2021,24.3878,0
236,Among the Sleep: Enhanced Edition,2021-10-21,28/10/2021,16.99,Krillbite Studio,2021,20.7278,0
237,DARQ,2021-10-28,04/11/2021,19.99,Unfold Games,2021,24.3878,0
238,Aven Colony,2021-11-04,11/11/2021,29.99,Team17 Digital Ltd,2021,36.587799999999994,0
239,Rogue Company Season 4 Epic Pack (DLC),2021-11-11,18/11/2021,0.0,Unknown Publisher,2021,0.0,0
240,Tiny Tinaâ€™s Assault on Dragon Keep: A Wonderlands One-Shot Adventure,2021-11-11,18/11/2021,9.99,2K,2021,12.1878,0
241,Guild of Dungeoneering,2021-11-18,25/11/2021,7.99,Gambrinous,2021,9.7478,0
242,KID A MNESIA EXHIBITION,2021-11-18,25/11/2021,0.0,Unknown Publisher,2021,0.0,0
243,Never Alone (Kisima Ingitchuna),2021-11-18,25/11/2021,14.99,E-Line Media,2021,18.2878,0
244,Antstream,2021-11-25,02/12/2021,39.99,Antstream Ltd,2021,48.787800000000004,0
245,theHunter: Call of the Wild,2021-11-25,02/12/2021,19.99,Unknown Publisher,2021,24.3878,0
246,Dead by Daylight,2021-12-02,09/12/2021,19.99,Behaviour Interactive Inc.,2021,24.3878,0
247,while True: learn(),2021-12-02,09/12/2021,12.99,Luden.Io,2021,15.8478,0
248,Godfall: Challenger Edition,2021-12-09,16/12/2021,24.99,Unknown Publisher,2021,30.487799999999996,0
249,Prison Architect,2021-12-09,16/12/2021,29.99,Paradox Interactive,2021,36.587799999999994,0
250,Shenmue III,2021-12-16,17/12/2021,29.99,Inin,2021,36.587799999999994,0
251,Neon Abyss,2021-12-17,18/12/2021,19.99,Team17,2021,24.3878,0
252,Remnant: From the Ashes,2021-12-18,19/12/2021,39.99,Arc Games,2021,48.787800000000004,0
253,The Vanishing of Ethan Carter,2021-12-19,20/12/2021,19.99,The Astronauts,2021,24.3878,0
254,Loop Hero,2021-12-20,21/12/2021,14.99,Devolver Digital,2021,18.2878,0
255,Second Extinction,2021-12-21,22/12/2021,0.0,Unknown Publisher,2021,0.0,0
256,Mutant Year Zero: Road to Eden,2021-12-22,23/12/2021,34.99,Funcom,2021,42.6878,0
257,Vampyr,2021-12-23,24/12/2021,39.99,Focus Entertainment,2021,48.787800000000004,0
258,Pathfinder: Kingmaker - Enhanced Plus Edition,2021-12-24,25/12/2021,19.99,Knights Peak,2021,24.3878,0
259,Prey,2021-12-25,26/12/2021,29.99,Bethesda Softworks,2021,36.587799999999994,0
260,Control,2021-12-26,27/12/2021,4.99,Valve,2021,6.0878000000000005,0
261,Mages of Mystralia,2021-12-27,28/12/2021,19.99,Borealys Games,2021,24.3878,0
262,Moving Out,2021-12-28,29/12/2021,24.99,Team17,2021,30.487799999999996,0
263,Salt and Sanctuary,2021-12-29,30/12/2021,17.99,Ska Studios,2021,21.947799999999997,0
264,"Tomb Raider Trilogy (Tomb Raider GOTY, Rise of the Tomb Raider, Shadow of the Tomb Raider)",2021-12-30,06/01/2022,0.0,Unknown Publisher,2021,0.0,0
265,Tomb Raider GOTY,2021-12-30,06/01/2022,19.8,Unknown Publisher,2021,24.156,0
266,Rise of the Tomb Raider,2021-12-30,06/01/2022,29.99,Crystal Dynamics,2021,36.587799999999994,0
267,Shadow of the Tomb Raider,2021-12-30,06/01/2022,59.99,Crystal Dynamics,2021,73.1878,0
268,Gods Will Fall,2022-01-06,13/01/2022,14.99,Deep Silver,2022,16.788800000000002,0
269,Galactic Civilizations III,2022-01-13,20/01/2022,29.99,Stardock Entertainment,2022,33.5888,0
270,Relicta,2022-01-20,27/01/2022,19.99,Ravenscourt,2022,22.3888,0
271,Daemon X Machina,2022-01-27,03/02/2022,49.99,Xseed Games,2022,55.988800000000005,0
272,Yooka-Laylee and the Impossible Lair,2022-02-03,10/02/2022,29.99,Team17 Digital Ltd,2022,33.5888,0
273,Windbound,2022-02-10,17/02/2022,29.99,Deep Silver,2022,33.5888,0
274,Brothers: A Tale of Two Sons,2022-02-17,24/02/2022,14.99,505 Games,2022,16.788800000000002,0
275,Cris Tales,2022-02-24,03/03/2022,39.99,Maximum Entertainment,2022,44.78880000000001,0
276,Black Widow: Recharged,2022-03-03,10/03/2022,9.99,Atari,2022,11.1888,0
277,Centipede: Recharged,2022-03-03,10/03/2022,9.99,Atari,2022,11.1888,0
278,Cities: Skylines,2022-03-10,17/03/2022,29.99,Paradox Interactive,2022,33.5888,0
279,In Sound Mind,2022-03-17,24/03/2022,34.99,Maximum Entertainment,2022,39.18880000000001,0
280,Demon's Tilt,2022-03-24,31/03/2022,19.99,Flarb Llc,2022,22.3888,0
281,City of Brass (repeat),2022-03-31,07/04/2022,0.0,Unknown Publisher,2022,0.0,0
282,Total War: Warhammer,2022-03-31,07/04/2022,59.99,Sega,2022,67.18880000000001,0
283,Rogue Legacy,2022-04-07,14/04/2022,14.99,Cellar Door Games,2022,16.788800000000002,0
284,The Vanishing of Ethan Carter,2022-04-07,14/04/2022,19.99,The Astronauts,2022,22.3888,0
285,Insurmountable,2022-04-14,21/04/2022,24.99,Daedalic Entertainment,2022,27.9888,0
286,XCOM 2,2022-04-14,21/04/2022,59.99,2K,2022,67.18880000000001,0
287,Amnesia: Rebirth,2022-04-21,28/04/2022,29.99,Frictional Games,2022,33.5888,0
288,Riverbond,2022-04-21,28/04/2022,24.99,Cococucumber,2022,27.9888,0
289,Just Die Already,2022-04-28,05/05/2022,14.99,Curve Games,2022,16.788800000000002,0
290,Paradigm,2022-04-28,05/05/2022,14.99,Jacob Janerka,2022,16.788800000000002,0
291,Terraforming Mars,2022-05-05,12/05/2022,19.99,Twin Sails Interactive,2022,22.3888,0
292,Jotun: Valhalla Edition,2022-05-12,19/05/2022,14.99,Thunder Lotus,2022,16.788800000000002,0
293,Prey,2022-05-12,19/05/2022,29.99,Bethesda Softworks,2022,33.5888,0
294,Redout: Enhanced Edition,2022-05-12,19/05/2022,19.99,34Bigthings Srl,2022,22.3888,0
295,Borderlands 3,2022-05-19,26/05/2022,59.99,2K,2022,67.18880000000001,0
296,Bioshock: The Collection,2022-05-26,02/06/2022,59.99,Unknown Publisher,2022,67.18880000000001,0
297,BioShock,2022-05-26,02/06/2022,19.99,2K,2022,22.3888,0
298,BioShock 2,2022-05-26,02/06/2022,19.99,2K,2022,22.3888,0
299,BioShock Infinite,2022-05-26,02/06/2022,29.99,2K,2022,33.5888,0
300,Wolfenstein: The New Order,2022-06-02,09/06/2022,19.99,Bethesda Softworks,2022,22.3888,0
301,Maneater,2022-06-09,16/06/2022,39.99,Tripwire Interactive,2022,44.78880000000001,0
302,Supraland,2022-06-16,23/06/2022,19.99,Supra Games,2022,22.3888,0
303,A Game of Thrones: The Board Game Digital Edition,2022-06-23,30/06/2022,19.99,Twin Sails Interactive,2022,22.3888,0
304,Car Mechanic Simulator 2018,2022-06-23,30/06/2022,19.99,Playway S.A.,2022,22.3888,0
305,Geneforge 1: Mutagen,2022-06-30,07/07/2022,19.99,Spiderweb Software,2022,22.3888,0
306,Hood: Outlaws & Legends,2022-06-30,07/07/2022,0.0,Unknown Publisher,2022,0.0,0
307,Iratus: Lord of the Dead,2022-06-30,07/07/2022,29.99,Daedalic Entertainment,2022,33.5888,0
308,Ancient Enemy,2022-07-07,14/07/2022,16.99,Grey Alien Games,2022,19.0288,0
309,Killing Floor 2,2022-07-07,14/07/2022,29.99,Tripwire Interactive,2022,33.5888,0
310,Shop Titans,2022-07-14,21/07/2022,0.0,"Kabam Games, Inc.",2022,0.0,0
311,Wonder Boy: The Dragon's Trap,2022-07-14,21/07/2022,19.99,Dotemu,2022,22.3888,0
312,Tannenberg,2022-07-21,28/07/2022,19.99,Blackmill Games,2022,22.3888,0
313,Lawn Mowing Simulator,2022-07-28,04/08/2022,19.99,Curve Games,2022,22.3888,0
314,Unrailed!,2022-08-04,11/08/2022,19.99,Daedalic Entertainment,2022,22.3888,0
315,"Cook, Serve, Delicious! 3?!",2022-08-11,18/08/2022,19.99,Vertigo Gaming Inc.,2022,22.3888,0
316,Doom 64,2022-08-18,25/08/2022,4.99,Bethesda Softworks,2022,5.588800000000001,0
317,Rumbleverse Boom Boxer Pack (DLC),2022-08-18,25/08/2022,0.0,Unknown Publisher,2022,0.0,0
318,Destiny 2,2022-08-25,01/09/2022,24.99,Bungie,2022,27.9888,0
319,Ring of Pain,2022-08-25,01/09/2022,19.99,Humble Games,2022,22.3888,0
320,Shadow of the Tomb Raider,2022-09-01,08/09/2022,59.99,Crystal Dynamics,2022,67.18880000000001,0
321,Submerged: Hidden Depths,2022-09-01,08/09/2022,29.99,Uppercut Games Pty Ltd,2022,33.5888,0
322,Hundred Days - Winemaking Simulator,2022-09-08,15/09/2022,24.99,Broken Arms Games,2022,27.9888,0
323,Realm Royale Reforged Epic Launch Bundle (DLC),2022-09-08,15/09/2022,0.0,Unknown Publisher,2022,0.0,0
324,Spirit of the North,2022-09-15,22/09/2022,19.99,Silver Lining Interactive,2022,22.3888,0
325,The Captain,2022-09-15,22/09/2022,19.99,Tomorrow Corporation,2022,22.3888,0
326,ARK: Survival Evolved (repeat),2022-09-22,29/09/2022,0.0,Unknown Publisher,2022,0.0,0
327,Gloomhaven,2022-09-22,29/09/2022,34.99,Twin Sails Interactive,2022,39.18880000000001,0
328,Runbow,2022-09-29,06/10/2022,14.99,13Am Games,2022,16.788800000000002,0
329,The Drone Racing League Simulator,2022-09-29,06/10/2022,9.99,The Drone Racing League,2022,11.1888,0
330,Rising Hell,2022-10-06,13/10/2022,9.99,Toge Productions,2022,11.1888,0
331,Slain: Back from Hell,2022-10-06,13/10/2022,12.99,Silver Lining Interactive,2022,14.548800000000002,0
332,Darkwood,2022-10-13,20/10/2022,14.99,Hooded Horse,2022,16.788800000000002,0
333,ToeJam & Earl: Back in the Groove!,2022-10-13,20/10/2022,14.99,Humanature Studios,2022,16.788800000000002,0
334,Evoland,2022-10-20,27/10/2022,9.99,Shiro Games,2022,11.1888,0
335,Fallout 3,2022-10-20,27/10/2022,9.99,Bethesda Softworks,2022,11.1888,0
336,Saturnalia,2022-10-27,03/11/2022,29.99,Santa Ragione,2022,33.5888,0
337,"Warhammer 40,000: Mechanicus",2022-10-27,03/11/2022,29.99,Kasedo Games,2022,33.5888,0
338,Filament,2022-11-03,10/11/2022,16.99,Kasedo Games,2022,19.0288,0
339,Rising Storm 2: Vietnam,2022-11-03,10/11/2022,24.99,Tripwire Interactive,2022,27.9888,0
340,Alba: A Wildlife Adventure,2022-11-10,17/11/2022,16.99,Ustwo Games,2022,19.0288,0
341,Shadow Tactics: Blades of the Shogun (repeat),2022-11-10,17/11/2022,0.0,Unknown Publisher,2022,0.0,0
342,Dark Deity,2022-11-17,24/11/2022,24.99,Indie.Io,2022,27.9888,0
343,Evil Dead: The Game,2022-11-17,24/11/2022,39.99,Unknown Publisher,2022,44.78880000000001,0
344,Star Wars: Squadrons,2022-11-24,01/12/2022,39.99,Electronic Arts,2022,44.78880000000001,0
345,Fort Triumph,2022-12-01,08/12/2022,19.99,Cookiebyte Entertainment,2022,22.3888,0
346,RPG in a Box,2022-12-01,08/12/2022,49.99,Quercus Quag Software,2022,55.988800000000005,0
347,Saints Row 4 Re-Elected,2022-12-08,15/12/2022,0.0,Deep Silver,2022,0.0,0
348,Wildcat Gun Machine,2022-12-08,15/12/2022,14.99,Daedalic Entertainment,2022,16.788800000000002,0
349,Bloons TD 6,2022-12-15,15/12/2022,13.99,Ninja Kiwi,2022,15.668800000000001,0
350,Horizon Chase Turbo,2022-12-16,16/12/2022,19.99,Aquiris,2022,22.3888,0
351,Costume Quest 2,2022-12-17,17/12/2022,14.99,Midnight City,2022,16.788800000000002,0
352,Sable,2022-12-19,20/12/2022,24.99,Raw Fury,2022,27.9888,0
353,Them's Fightin' Herds,2022-12-20,21/12/2022,31.98,Gameplay Group International,2022,35.817600000000006,0
354,Wolfenstein: The New Order,2022-12-21,22/12/2022,19.99,Bethesda Softworks,2022,22.3888,0
355,LEGO Builder's Journey,2022-12-22,23/12/2022,19.99,Legoâ® Games,2022,22.3888,0
356,Fallout Classic Collection,2022-12-23,24/12/2022,19.99,Unknown Publisher,2022,22.3888,0
357,Encased,2022-12-24,25/12/2022,29.99,Prime Matter,2022,33.5888,0
358,Metro: Last Light Redux,2022-12-25,26/12/2022,19.99,Deep Silver,2022,22.3888,0
359,Death Stranding,2022-12-26,27/12/2022,39.99,505 Games,2022,44.78880000000001,0
360,F.I.S.T.: Forged In Shadow Torch,2022-12-27,28/12/2022,15.99,Astrolabe Games,2022,17.908800000000003,0
361,Severed Steel,2022-12-28,29/12/2022,24.99,Greylock Studio,2022,27.9888,0
362,Dishonored,2022-12-29,05/01/2023,9.99,Bethesda Softworks,2022,11.1888,0
363,Eximius: Seize the Frontline,2022-12-29,05/01/2023,19.99,Ammobox Studios,2022,22.3888,0
364,Mortal Shell,2022-12-29,05/01/2023,29.99,Playstack,2022,33.5888,0
365,Kerbal Space Program,2023-01-05,12/01/2023,39.99,Private Division,2023,43.18920000000001,0
366,Shadow Tactics: Blades Of The Shogun - Aiko's Choice,2023-01-05,12/01/2023,19.99,Daedalic Entertainment,2023,21.589199999999998,0
367,Divine Knockout,2023-01-12,19/01/2023,0.0,Unknown Publisher,2023,0.0,0
368,First Class Trouble,2023-01-12,19/01/2023,14.99,Invisible Walls,2023,16.1892,0
369,Epistory's Typing Chronicles,2023-01-19,26/01/2023,0.0,Unknown Publisher,2023,0.0,0
370,Gamedec,2023-01-19,26/01/2023,6.99,Anshar Publishing,2023,7.549200000000001,0
371,Adios,2023-01-26,02/02/2023,17.99,Mischief,2023,19.429199999999998,0
372,Hell is Others,2023-01-26,02/02/2023,14.99,A List Games,2023,16.1892,0
373,City of Gangsters,2023-02-02,09/02/2023,29.99,Kasedo Games,2023,32.3892,0
374,Dishonored: Death of the Outsider,2023-02-02,09/02/2023,29.99,Bethesda Softworks,2023,32.3892,0
375,Recipe for Disaster,2023-02-09,16/02/2023,16.99,Kasedo Games,2023,18.3492,0
376,Warpips,2023-02-16,23/02/2023,16.99,Daedalic Entertainment,2023,18.3492,0
377,Duskers,2023-02-23,02/03/2023,19.99,Misfits Attic,2023,21.589199999999998,0
378,Rise of Industry,2023-03-02,09/03/2023,29.99,Kasedo Games,2023,32.3892,0
379,Call of the Sea,2023-03-09,16/03/2023,19.99,Raw Fury,2023,21.589199999999998,0
380,"Warhammer 40,000: Gladius - Relics Of War",2023-03-16,23/03/2023,39.99,Slitherine Ltd.,2023,43.18920000000001,0
381,Chess Ultra,2023-03-23,30/03/2023,12.99,Ripstone,2023,14.029200000000001,0
382,World of Warships â€” Starter Pack: Ishizuchi,2023-03-23,30/03/2023,21.6,Wargaming Group Limited,2023,23.328000000000003,0
383,The Silent Age,2023-03-30,06/04/2023,9.99,Unknown Publisher,2023,10.789200000000001,0
384,Tunche,2023-03-30,06/04/2023,19.99,Hypetrain Digital,2023,21.589199999999998,0
385,Dying Light,2023-04-06,13/04/2023,24.99,Techland,2023,26.9892,0
386,shapez,2023-04-06,13/04/2023,9.99,Tobspr Games,2023,10.789200000000001,0
387,Mordhau,2023-04-13,20/04/2023,29.99,Triternion,2023,32.3892,0
388,Second Extinction,2023-04-13,20/04/2023,0.0,Unknown Publisher,2023,0.0,0
389,Beyond Blue,2023-04-20,27/04/2023,19.99,E-Line Media,2023,21.589199999999998,0
390,Never Alone (Kisima Ingitchuna),2023-04-20,27/04/2023,14.99,E-Line Media,2023,16.1892,0
391,Breathedge,2023-04-27,04/05/2023,24.99,Hypetrain Digital,2023,26.9892,0
392,Poker Club,2023-04-27,04/05/2023,19.99,Ripstone,2023,21.589199999999998,0
393,Against All Odds,2023-05-04,11/05/2023,4.99,25 Crimson,2023,5.389200000000001,0
394,Horizon Chase Turbo,2023-05-04,11/05/2023,19.99,Aquiris,2023,21.589199999999998,0
395,Kao the Kangaroo,2023-05-04,11/05/2023,29.99,Tate Multimedia,2023,32.3892,0
396,The Sims 4 The Daring Lifestyle Bundle,2023-05-11,18/05/2023,0.0,Unknown Publisher,2023,0.0,0
397,Death Stranding,2023-05-18,25/05/2023,39.99,505 Games,2023,43.18920000000001,0
398,Fallout: New Vegas,2023-05-25,01/06/2023,9.99,Bethesda Softworks,2023,10.789200000000001,0
399,Midnight Ghost Hunt,2023-06-01,08/06/2023,19.99,Coffee Stain Publishing,2023,21.589199999999998,0
400,PAYDAY 2,2023-06-08,15/06/2023,9.99,Starbreeze Entertainment,2023,10.789200000000001,0
401,Guacamelee! 2,2023-06-15,22/06/2023,19.99,Drinkbox Studios,2023,21.589199999999998,0
402,Guacamelee!,2023-06-15,22/06/2023,19.99,Drinkbox Studios,2023,21.589199999999998,0
403,TheHunter: Call of the Wild,2023-06-22,29/06/2023,19.99,Unknown Publisher,2023,21.589199999999998,0
404,Idle Champions Of The Forgotten Realms Pack,2023-06-22,29/06/2023,0.0,Unknown Publisher,2023,0.0,0
405,The Dungeon of Naheulbeuk: The Amulet of Chaos,2023-06-29,06/07/2023,34.99,Dear Villagers,2023,37.78920000000001,0
406,Grime,2023-07-06,13/07/2023,24.99,Akupara Games,2023,26.9892,0
407,Train Valley 2,2023-07-13,20/07/2023,14.99,Flazm,2023,16.1892,0
408,Murder by Numbers,2023-07-20,27/07/2023,14.99,The Irregular Corporation,2023,16.1892,0
409,The Elder Scrolls Online,2023-07-20,27/07/2023,19.99,Bethesda Softworks,2023,21.589199999999998,0
410,Homeworld Remastered Collection,2023-07-27,03/08/2023,34.99,Gearbox Publishing,2023,37.78920000000001,0
411,Severed Steel,2023-07-27,03/08/2023,24.99,Greylock Studio,2023,26.9892,0
412,Bloons TD 6,2023-08-03,10/08/2023,13.99,Ninja Kiwi,2023,15.109200000000001,0
413,Loop Hero,2023-08-03,10/08/2023,14.99,Devolver Digital,2023,16.1892,0
414,Europa Universalis IV (repeat),2023-08-10,17/08/2023,0.0,Unknown Publisher,2023,0.0,0
415,Orwell: Keeping an Eye on You,2023-08-10,17/08/2023,9.99,Daedalic Entertainment,2023,10.789200000000001,0
416,Black Book,2023-08-17,24/08/2023,24.99,Hypetrain Digital,2023,26.9892,0
417,Dodo Peak,2023-08-17,24/08/2023,9.99,Moving Pieces Interactive,2023,10.789200000000001,0
418,Homeworld: Deserts of Kharak,2023-08-24,31/08/2023,49.99,Gearbox Publishing,2023,53.989200000000004,0
419,Cave Story+,2023-08-31,07/09/2023,14.99,"Nicalis, Inc.",2023,16.1892,0
420,Spelldrifter,2023-08-31,07/09/2023,19.99,Free Range Games,2023,21.589199999999998,0
421,911 Operator,2023-09-14,21/09/2023,14.99,Games Operators,2023,16.1892,0
422,Out of Line,2023-09-14,21/09/2023,8.99,Hatinh Interactive,2023,9.709200000000001,0
423,The Forest Quartet,2023-09-21,28/09/2023,9.99,Bedtime Digital Games,2023,10.789200000000001,0
424,Model Builder,2023-09-28,05/10/2023,19.99,Green Man Gaming Publishing,2023,21.589199999999998,0
425,Soulstice,2023-09-28,05/10/2023,39.99,Maximum Entertainment,2023,43.18920000000001,0
426,Godlike Burger,2023-10-05,12/10/2023,19.99,Daedalic Entertainment,2023,21.589199999999998,0
427,Blazing Sails,2023-10-12,19/10/2023,14.99,Iceberg Interactive,2023,16.1892,0
428,Q.U.B.E. Ultimate Bundle,2023-10-12,19/10/2023,0.0,Unknown Publisher,2023,0.0,0
429,Eternal Threads,2023-10-19,26/10/2023,19.99,Secret Mode,2023,21.589199999999998,0
430,The Evil Within,2023-10-19,26/10/2023,19.99,Bethesda Softworks,2023,21.589199999999998,0
431,Tandem: A Tale of Shadows,2023-10-26,02/11/2023,9.99,Hatinh Interactive,2023,10.789200000000001,0
432,The Evil Within 2,2023-10-26,02/11/2023,39.99,Bethesda Softworks,2023,43.18920000000001,0
433,F.I.S.T.: Forged In Shadow Torch,2023-11-02,09/11/2023,15.99,Astrolabe Games,2023,17.2692,0
434,Turnip Boy Commits Tax Evasion,2023-11-02,09/11/2023,14.99,Graffiti Games,2023,16.1892,0
435,Earthlock,2023-11-09,16/11/2023,29.99,Snowcastle Games,2023,32.3892,0
436,Golden Light,2023-11-09,16/11/2023,19.99,Mr. Pink,2023,21.589199999999998,0
437,Deliver Us Mars,2023-11-16,23/11/2023,29.99,Frontier Foundry,2023,32.3892,0
438,Surviving the Aftermath,2023-11-16,23/11/2023,29.99,Paradox Interactive,2023,32.3892,0
439,Jitsu Squad,2023-11-23,30/11/2023,9.99,Tanuki Creative Studio,2023,10.789200000000001,0
440,Mighty Fight Federation,2023-11-23,30/11/2023,29.99,Forthright Entertainment,2023,32.3892,0
441,GigaBash,2023-11-30,07/12/2023,24.99,Passion Republic Games,2023,26.9892,0
442,Predecessor,2023-11-30,07/12/2023,29.99,Omeda Studios,2023,32.3892,0
443,Destiny 2: Legacy Collection,2023-12-07,14/12/2023,69.99,Unknown Publisher,2023,75.5892,0
444,DNF Duel,2023-12-20,21/12/2023,49.99,Nexon,2023,53.989200000000004,0
445,Melvor Idle,2023-12-21,22/12/2023,9.99,Jagex Ltd,2023,10.789200000000001,0
446,20 Minutes Till Dawn,2023-12-21,31/12/2023,4.99,Erabit,2023,5.389200000000001,0
447,A Plague Tale: Innocence (repeat),2023-12-21,31/12/2023,0.0,Unknown Publisher,2023,0.0,0
448,Additional minor DLC / cosmetics slots (holiday pack group)*,2023-12-21,31/12/2023,0.0,Unknown Publisher,2023,0.0,0
449,Black Book (repeat),2023-12-21,31/12/2023,0.0,Unknown Publisher,2023,0.0,0
450,Dishonored: Death of the Outsider,2023-12-21,31/12/2023,29.99,Bethesda Softworks,2023,32.3892,0
451,Escape Academy,2023-12-21,31/12/2023,19.99,Iam8Bit Presents,2023,21.589199999999998,0
452,Grime,2023-12-21,31/12/2023,24.99,Akupara Games,2023,26.9892,0
453,Idle Champions of the Forgotten Realms (DLC pack),2023-12-21,31/12/2023,0.0,Unknown Publisher,2023,0.0,0
454,Marvel's Guardians of the Galaxy,2023-12-21,31/12/2023,59.99,Eidos Interactive Corp.,2023,64.78920000000001,0
455,theHunter: Call of the Wild (repeat),2023-12-21,31/12/2023,0.0,Unknown Publisher,2023,0.0,0
456,Train Sim World 3 (example holiday slot)*,2023-12-21,31/12/2023,0.0,Unknown Publisher,2023,0.0,0
457,Train Valley 2,2023-12-21,31/12/2023,14.99,Flazm,2023,16.1892,0
458,Turnip Boy Commits Tax Evasion (repeat),2023-12-21,31/12/2023,0.0,Unknown Publisher,2023,0.0,0
459,Art of Rally,2023-12-22,23/12/2023,24.99,Funselektor Labs Inc.,2023,26.9892,0
460,Fallout 3,2023-12-23,24/12/2023,9.99,Bethesda Softworks,2023,10.789200000000001,0
461,Ghostwire: Tokyo,2023-12-24,25/12/2023,59.99,Bethesda Softworks,2023,64.78920000000001,0
462,The Outer Worlds,2023-12-25,26/12/2023,29.99,Private Division,2023,32.3892,0
463,Human Resource Machine,2023-12-26,27/12/2023,14.99,Tomorrow Corporation,2023,16.1892,0
464,Cursed to Golf,2023-12-27,28/12/2023,19.99,Thunderful Publishing,2023,21.589199999999998,0
465,Cat Quest,2023-12-28,29/12/2023,12.99,Kepler Interactive,2023,14.029200000000001,0
466,Snakebird Complete,2023-12-29,30/12/2023,14.99,Unknown Publisher,2023,16.1892,0
467,Saints Row (2022),2023-12-30,31/12/2023,0.0,Unknown Publisher,2023,0.0,0
468,Ghostrunner,2023-12-31,01/01/2024,29.99,505 Games,2023,32.3892,0
469,Escape Academy,2024-01-01,02/01/2024,19.99,Iam8Bit Presents,2024,20.7896,0
470,20 Minutes Till Dawn,2024-01-02,03/01/2024,4.99,Erabit,2024,5.1896,0
471,A Plague Tale: Innocence,2024-01-03,04/01/2024,39.99,Focus Entertainment,2024,41.589600000000004,0
472,Marvel's Guardians of the Galaxy,2024-01-04,11/01/2024,59.99,Eidos Interactive Corp.,2024,62.3896,0
473,Sail Forth,2024-01-11,18/01/2024,19.99,The Quantum Astrophysicists Guild,2024,20.7896,0
474,LOVE,2024-01-18,25/01/2024,2.99,Wealthbird,2024,3.1096000000000004,0
475,Infinifactory,2024-01-25,01/02/2024,24.99,Zachtronics,2024,25.9896,0
476,Doors: Paradox,2024-02-01,08/02/2024,14.99,Snapbreak,2024,15.5896,0
477,Lost Castle,2024-02-08,15/02/2024,9.99,Hunter Studio,2024,10.3896,0
478,Doki Doki Literature Club Plus!,2024-02-08,15/02/2024,14.99,Serenity Forge,2024,15.5896,0
479,Dakar Desert Rally,2024-02-15,22/02/2024,29.99,Saber Interactive,2024,31.1896,0
480,Super Meat Boy Forever,2024-02-22,29/02/2024,4.99,Team Meat,2024,5.1896,0
481,Aerial_Knight's Never Yield,2024-02-29,07/03/2024,11.99,Headup,2024,12.4696,0
482,Thief (2014),2024-03-04,11/04/2024,0.0,Unknown Publisher,2024,0.0,0
483,The Outer Worlds,2024-03-04,11/04/2024,29.99,Private Division,2024,31.1896,0
484,Astro Duel,2024-03-07,14/03/2024,9.99,Wild Rooster,2024,10.3896,0
485,The Bridge,2024-03-14,21/03/2024,9.99,The Quantum Astrophysicists Guild,2024,10.3896,0
486,LISA: The Painful,2024-03-14,21/03/2024,19.99,Serenity Forge,2024,20.7896,0
487,Deus Ex: Mankind Divided,2024-03-14,21/03/2024,29.99,Eidos Interactive Corp.,2024,31.1896,0
488,Call of The Wild: The Angler,2024-03-21,28/03/2024,29.99,Avalanche Studios,2024,31.1896,0
489,Invincible Presents: Atom Eve,2024-03-21,28/03/2024,9.99,Skybound Games,2024,10.3896,0
490,Islets,2024-03-28,04/04/2024,19.99,Armor Games Studios,2024,20.7896,0
491,Circus Electrique,2024-04-04,11/04/2024,19.99,Zen Studios,2024,20.7896,0
492,Ghostrunner,2024-04-11,18/04/2024,29.99,505 Games,2024,31.1896,0
493,The Big Con,2024-04-18,25/04/2024,14.99,Skybound Games,2024,15.5896,0
494,Town of Salem 2,2024-04-18,25/04/2024,0.0,Digital Bandidos,2024,0.0,0
495,Circus Electrique,2024-04-18,25/04/2024,19.99,Zen Studios,2024,20.7896,0
496,Industria,2024-04-25,02/05/2024,19.99,Headup,2024,20.7896,0
497,Orcs Must Die! 3,2024-05-02,09/05/2024,29.99,Robot Entertainment,2024,31.1896,0
498,LISA: The Joyful,2024-05-02,09/05/2024,9.99,Serenity Forge,2024,10.3896,0
499,Cat Quest II,2024-05-02,09/05/2024,14.99,Kepler Interactive,2024,15.5896,0
500,Orcs Must Die! 2 (repeat),2024-05-09,16/05/2024,0.0,Unknown Publisher,2024,0.0,0
501,Firestone: Online Idle RPG,2024-05-09,16/05/2024,0.0,Holyday Studios,2024,0.0,0
502,Dragon Age: Inquisition,2024-05-16,23/05/2024,39.99,Electronic Arts,2024,41.589600000000004,0
503,Farming Simulator 22,2024-05-23,30/05/2024,19.99,Giants Software,2024,20.7896,0
504,Chivalry 2,2024-05-30,06/06/2024,39.99,Tripwire Presents,2024,41.589600000000004,0
505,Marvel's Midnight Suns,2024-05-30,06/06/2024,59.99,2K,2024,62.3896,0
506,Redout 2,2024-06-06,13/06/2024,19.99,34Bigthings Srl,2024,20.7896,0
507,Idle Champions of the Forgotten Realms (DLC pack),2024-06-13,20/06/2024,0.0,Unknown Publisher,2024,0.0,0
508,Freshly Frosted + Rumble Club pack,2024-06-20,27/06/2024,0.0,Unknown Publisher,2024,0.0,0
509,Sunless Skies: Sovereign Edition,2024-06-27,04/07/2024,24.99,Failbetter Games,2024,25.9896,0
510,The Falconeer,2024-07-04,11/07/2024,19.99,Wired Productions,2024,20.7896,0
511,Floppy Knights,2024-07-11,18/07/2024,7.99,Rose City Games,2024,8.3096,0
512,Arcade Paradise,2024-07-18,25/07/2024,19.99,Wired Productions,2024,20.7896,0
513,Maid of Sker,2024-07-18,25/07/2024,24.99,Wales Interactive,2024,25.9896,0
514,F.I.S.T.: Forged In Shadow Torch,2024-07-25,01/08/2024,15.99,Astrolabe Games,2024,16.6296,0
515,LumbearJack,2024-08-01,08/08/2024,12.99,Armor Games Studios,2024,13.5096,0
516,Rawmen: Food Fighter Arena,2024-08-01,08/08/2024,0.0,Tinybuild,2024,0.0,0
517,DNF Duel,2024-08-08,15/08/2024,49.99,Nexon,2024,51.9896,0
518,CYGNI: All Guns Blazing,2024-08-08,15/08/2024,29.99,Konami,2024,31.1896,0
519,Death's Gambit: Afterlife,2024-08-15,22/08/2024,19.99,Serenity Forge,2024,20.7896,0
520,World of Warships â€“ Starter Pack: Albany,2024-08-15,22/08/2024,23.6,Unknown Publisher,2024,24.544000000000004,0
521,Gigantic: Rampage Edition,2024-08-22,29/08/2024,19.99,Arc Games,2024,20.7896,0
522,The Callisto Protocol,2024-08-22,29/08/2024,59.99,"Krafton, Inc.",2024,62.3896,0
523,Fallout Classic Edition,2024-08-29,05/09/2024,0.0,Unknown Publisher,2024,0.0,0
524,Wild Card Football,2024-08-29,05/09/2024,0.0,Unknown Publisher,2024,0.0,0
525,Football Manager 2024,2024-09-05,12/09/2024,5.99,Sega,2024,6.2296000000000005,0
526,Sniper Ghost Warrior Contracts,2024-09-05,12/09/2024,29.99,Ci Games,2024,31.1896,0
527,Rugrats: Adventures in Gameland,2024-09-12,19/09/2024,19.99,The Mix Games,2024,20.7896,0
528,Super Crazy Rhythm Castle,2024-09-12,19/09/2024,19.99,Konami,2024,20.7896,0
529,Toem,2024-09-19,26/09/2024,19.99,Something We Made,2024,20.7896,0
530,The Last Stand: Aftermath,2024-09-19,26/09/2024,24.99,Armor Games Studios,2024,25.9896,0
531,The Spirit and the Mouse,2024-09-26,03/10/2024,19.99,Armor Games Studios,2024,20.7896,0
532,Bear and Breakfast,2024-10-03,10/10/2024,19.99,Armor Games Studios,2024,20.7896,0
533,Outliver: Tribulation,2024-10-10,17/10/2024,7.99,Gbrossoft,2024,8.3096,0
534,Empyrion - Galactic Survival,2024-10-10,17/10/2024,19.99,Eleon Game Studios,2024,20.7896,0
535,Kardboard Kings: Card Shop Simulator,2024-10-17,17/10/2024,19.99,Akupara Games,2024,20.7896,0
536,Invincible Presents: Atom Eve,2024-10-17,24/10/2024,9.99,Skybound Games,2024,10.3896,0
537,Moving Out,2024-10-24,31/10/2024,24.99,Team17,2024,25.9896,0
538,Ghostwire: Tokyo,2024-10-31,07/11/2024,59.99,Bethesda Softworks,2024,62.3896,0
539,Witch It,2024-10-31,07/11/2024,19.99,Barrel Roll Games,2024,20.7896,0
540,Deceive Inc.,2024-11-07,14/11/2024,19.99,Tripwire Presents,2024,20.7896,0
541,Castlevania Anniversary Collection,2024-11-14,21/11/2024,19.99,Konami,2024,20.7896,0
542,Snakebird Complete,2024-11-14,21/11/2024,14.99,Unknown Publisher,2024,15.5896,0
543,Beholder,2024-11-21,28/11/2024,13.99,Alawar,2024,14.5496,0
544,Brotato,2024-11-28,05/12/2024,4.99,Blobfish,2024,5.1896,0
545,Lego Star Wars: The Skywalker Saga,2024-12-05,12/12/2024,49.99,Warner Bros. Games,2024,51.9896,0
546,Bus Simulator 21 Next Stop,2024-12-05,12/12/2024,34.99,Astragon Entertainment,2024,36.3896,0
547,The Lord of the Rings: Return to Moria,2024-12-12,19/12/2024,24.99,North Beach Games,2024,25.9896,0
548,Vampire Survivors,2024-12-19,20/12/2024,4.99,Poncle,2024,5.1896,0
549,Astrea: Six-Sided Oracles,2024-12-20,21/12/2024,24.99,Akupara Games,2024,25.9896,0
550,TerraTech,2024-12-21,22/12/2024,24.99,Mythwright,2024,25.9896,0
551,Wizard of Legend,2024-12-22,23/12/2024,15.99,Contingent99,2024,16.6296,0
552,Dark and Darker,2024-12-23,24/12/2024,0.0,Ironmace,2024,0.0,0
553,DREDGE,2024-12-24,25/12/2024,24.99,Team17,2024,25.9896,0
554,Control,2024-12-25,26/12/2024,4.99,Valve,2024,5.1896,0
555,Ghostrunner 2,2024-12-26,27/12/2024,39.99,505 Games,2024,41.589600000000004,0
556,Hot Wheels Unleashed,2024-12-27,28/12/2024,39.99,Milestone S.R.L.,2024,41.589600000000004,0
557,KILL KNIGHT,2024-12-28,29/12/2024,14.99,Playside,2024,15.5896,0
558,Orcs Must Die! 3 (repeat),2024-12-29,30/12/2024,0.0,Unknown Publisher,2024,0.0,0
559,REDACTED (mystery day 2024)*,2024-12-30,31/12/2024,0.0,Unknown Publisher,2024,0.0,0
560,Sifu,2024-12-31,01/01/2025,39.99,Sloclap,2024,41.589600000000004,0
561,Kingdom Come: Deliverance,2025-01-01,02/01/2025,29.99,Warhorse Studios,2025,30.2899,0
562,Hell Let Loose,2025-01-02,09/01/2025,49.99,Team17,2025,50.489900000000006,0
563,Turmoil,2025-01-09,16/01/2025,12.99,Kiwiclockwork Studios,2025,13.1199,0
564,Escape Academy,2025-01-16,23/01/2025,19.99,Iam8Bit Presents,2025,20.189899999999998,0
565,Behind the Frame: The Finest Scenery,2025-01-23,30/01/2025,12.99,Akupara Games,2025,13.1199,0
566,Undying,2025-01-30,06/02/2025,19.99,Unknown Publisher,2025,20.189899999999998,0
567,Beyond Blue,2025-02-06,13/02/2025,19.99,E-Line Media,2025,20.189899999999998,0
568,Humankind,2025-02-06,13/02/2025,49.99,Amplitude Studios,2025,50.489900000000006,0
569,F1 Manager 2024,2025-02-13,20/02/2025,34.99,Frontier Developments,2025,35.3399,0
570,Garden Story,2025-02-20,27/02/2025,19.99,Rose City Games,2025,20.189899999999998,0
571,World War Z Aftermath,2025-02-20,27/02/2025,39.99,Saber Interactive Inc,2025,40.389900000000004,0
572,Mages of Mystralia,2025-02-27,06/03/2025,19.99,Borealys Games,2025,20.189899999999998,0
573,Them's Fightin' Herds,2025-03-06,13/03/2025,31.98,Gameplay Group International,2025,32.2998,0
574,Mortal Shell,2025-03-13,20/03/2025,29.99,Playstack,2025,30.2899,0
575,World Of Warships â€“ Anniversary Party Flavor,2025-03-13,20/03/2025,0.0,Unknown Publisher,2025,0.0,0
576,Jurassic World Evolution 2,2025-03-20,27/03/2025,59.99,Frontier Developments,2025,60.5899,0
577,Cat Quest,2025-03-27,03/04/2025,12.99,Kepler Interactive,2025,13.1199,0
578,"Neko Ghost, Jump!",2025-03-27,03/04/2025,9.99,Burgos Games,2025,10.0899,0
579,Cat Quest 2,2025-04-03,10/04/2025,14.99,Kepler Interactive,2025,15.1399,0
580,River City Girls,2025-04-10,17/04/2025,29.99,Wayforward,2025,30.2899,0
581,Botanicula,2025-04-17,24/04/2025,14.99,Amanita Design,2025,15.1399,0
582,Chuchel,2025-04-24,01/05/2025,9.99,Amanita Design,2025,10.0899,0
583,Albion Online Welcome Gift,2025-04-24,01/05/2025,0.0,Unknown Publisher,2025,0.0,0
584,Super Space Club,2025-05-01,08/05/2025,14.99,Grahamoflegend,2025,15.1399,0
585,Deadtime Defenders,2025-05-08,15/05/2025,9.99,Arcane Embers,2025,10.0899,0
586,Touch Type Tale,2025-05-08,15/05/2025,19.99,Mythwright,2025,20.189899999999998,0
587,Happy Game,2025-05-15,22/05/2025,13.13,Amanita Design,2025,13.2613,0
588,Dead Island 2,2025-05-15,22/05/2025,59.99,Deep Silver,2025,60.5899,0
589,Deliver At All Costs,2025-05-22,29/05/2025,29.99,Konami,2025,30.2899,0
590,Gigapocalypse,2025-05-22,29/05/2025,9.99,Headup,2025,10.0899,0
591,Sifu,2025-05-22,29/05/2025,39.99,Sloclap,2025,40.389900000000004,0
592,Limbo,2025-05-29,05/06/2025,12.49,Playdead,2025,12.6149,0
593,Tiny Tina's Wonderlands,2025-05-29,05/06/2025,59.99,2K,2025,60.5899,0
594,Deathloop,2025-06-05,12/06/2025,59.99,Bethesda Softworks,2025,60.5899,0
595,Ogu and the Secret Forest,2025-06-05,12/06/2025,24.99,Sinkhole Studio,2025,25.2399,0
596,Two Point Hospital,2025-06-12,19/06/2025,29.99,Sega,2025,30.2899,0
597,The Operator,2025-06-19,26/06/2025,13.99,Bureau 81,2025,14.129900000000001,0
598,Sable,2025-06-26,03/07/2025,24.99,Raw Fury,2025,25.2399,0
599,Backpack Hero,2025-07-03,10/07/2025,19.99,Pretty Soon,2025,20.189899999999998,0
600,Figment,2025-07-03,10/07/2025,19.99,Bedtime Digital Games,2025,20.189899999999998,0
601,Figment 2,2025-07-10,17/07/2025,24.99,Bedtime Digital Games,2025,25.2399,0
602,Sky Racket,2025-07-10,17/07/2025,14.99,Double Dash Studios,2025,15.1399,0
603,Civilization 6 Platinum Edition,2025-07-17,24/07/2025,0.0,Unknown Publisher,2025,0.0,0
604,Legion TD2,2025-07-24,31/07/2025,19.99,Autoattack Games,2025,20.189899999999998,0
605,Keylocker,2025-07-31,07/08/2025,19.99,Serenity Forge,2025,20.189899999999998,0
606,Pilgrims,2025-07-31,07/08/2025,6.99,Amanita Design,2025,7.0599,0
607,112 Operator,2025-08-07,14/08/2025,24.99,Games Operators,2025,25.2399,0
608,Road Redemption,2025-08-07,14/08/2025,19.99,Tripwire Presents,2025,20.189899999999998,0
609,Hidden Folks,2025-08-14,21/08/2025,14.99,Adriaan De Jongh,2025,15.1399,0
610,Totally Reliable Delivery Service,2025-08-14,21/08/2025,14.99,Infogrames,2025,15.1399,0
611,Kamaeru: A Frog Refuge,2025-08-21,28/08/2025,19.99,Armor Games Studios,2025,20.189899999999998,0
612,Strange Horticulture,2025-08-21,28/08/2025,15.99,Iceberg Interactive,2025,16.1499,0
613,Machinarium,2025-08-28,04/09/2025,19.99,Amanita Design,2025,20.189899999999998,0
614,Make Way,2025-08-28,04/09/2025,14.99,Secret Mode,2025,15.1399,0
615,Monument Valley,2025-09-04,11/09/2025,7.99,Ustwo Games,2025,8.0699,0
616,Ghostrunner 2,2025-09-11,18/09/2025,39.99,505 Games,2025,40.389900000000004,0
617,Monument Valley 2,2025-09-11,18/09/2025,7.99,Ustwo Games,2025,8.0699,0
618,The Battle of Polytopia,2025-09-11,18/09/2025,14.99,Midjiwan Ab,2025,15.1399,0
619,Project Winter,2025-09-18,25/09/2025,9.99,Other Ocean Group,2025,10.0899,0
620,Samorost 2,2025-09-18,25/09/2025,4.99,Amanita Design,2025,5.0399,0
621,Rustler - Grand Theft Horse,2026-01-22,29-01-2026,24.99,Games Operators,2026,24.99,0
